{
  "assay_id": "fixture_validation_v1",
  "target_id": "fixture_target",
  "target_species": "Synthetic test virus",
  "forward_primer": "GCGAGGAAGATGTACGGATA",
  "reverse_primer": "GCTACAGGCTCCCTTCTAA",
  "probe": "ATCGCGGTTAACCTAGTCCCTGTGC",
  "template": "TGGGCGAACTTGGTCACCCCGAAGTATCTGATGAGATGATCACCGAGAGCCGGGGCGAGGAAGATGTACGGATACTTTCCGCACAGGGACTAGGTTAACCGCGATTTCTTATCCTGCGATAGCCGGCCGTGTAAACCTTTCTTAGGCATGGCAGAAAATGCAATCATATAACGGGGTTAGAAGGGAGCCTGTAGCATGCTGCCCGATTTCCCGTGTACCCCTGTCGCTGCGAAGTATATCCAGAGGTGCCGGTGCTAGCC",
  "host_species": "pig",
  "host_db": "testdata/host.fasta",
  "cross_db": "testdata/cross_species.fasta",
  "allow_fallback": true
}
